text,sentiment,model,topic,cleaned
MySejahtera will be listed among apps accepted by EU members; M'sia to seek clarification on Sinovac recipients | New Straits Times https://t.co/4PF9boIEdW,,cnn-lstm,sinovac,mysejahtera list among apps accepted member msia seek clarification sinovac recipient new strait time
"@luongphucnguyen @Gab_H_R Sinovac permits the pathogenic response by establishing M-protein specific germinal centers.  That's likely why breakthrough hospitalizations for WIV vaccines are so high.

https://t.co/gxu8JEtQ5N",,cnn-lstm,sinovac,sinovac permit pathogenic response establish mprotein specific germinal center likely breakthrough hospitalization wiv vaccine high
"@OlafScholz One planet, many countries, one type of HUMAN, one VIRUS, A LOT OF VACCINES. 
Virus is the enemy 😃😂
Sinovac/Turkovac CANNOT enter Germany.
Is Virus having a nationality ?
Or you guys, politicians, know that it was a created scenario for human’s transition to the digital age?",,cnn-lstm,sinovac,planet many country type human virus lot vaccine virus enemy sinovacturkovac dropout germany virus nationality guy politician know create scenario human transition digital age
"@Gab_H_R HK has mostly Sinovac, whic is less effective, and about only 50% of 80+ have first-dose due to misinformation.",,cnn-lstm,sinovac,mostly sinovac whic less effective firstdose due misinformation
"(Disclaimer: SinoVac -in 2/3 doses performs decently against severe diseases and death by omicron but that’s literally the *bare minimum* a vaccine should do.
You have an intervention that clearly demonstrated superiority and yet recommending the inferior is what they went for)",,cnn-lstm,sinovac,disclaimer sinovac dos performs decently severe disease death omicron literally bare minimum vaccine intervention clearly demonstrate superiority yet recommend inferior
"@tripperhead @matt_1221_hk There is nothing wrong with Sinovac in preventing death, yes BioNTech is better but Sinovac is doing a great job preventing sever cases.",,cnn-lstm,sinovac,nothing wrong sinovac prevent death yes biontech well sinovac great job prevent sever case
"Next up: Carrie Lam prosecutes HKU for publishing data that suggests that BioNTech has better efficacy than SinoVac even though it was painfully obvious even at PhIII studies 1 year ago.

(On second thought, maybe I shouldn’t give this government ideas) https://t.co/hydY37etdp",,cnn-lstm,sinovac,next carrie lam prosecutes hku publishing data suggests biontech well efficacy sinovac even though painfully obvious even phiii study year ago second thought maybe starve government idea
"RT @Pdaus_Shajahan: Something wrong, sinovac receipients did not get to choose what vaccines. Now you bully them.",,cnn-lstm,sinovac,something wrong sinovac receipients leave choose vaccine bully
"@OOLine9 Overall. Considering most ppl at that age band took Sinovac, one can infer that Sinovac can’t be bad. You can find efficacy of Sinovac and BNT here: https://t.co/4ILt7rXtuO",,cnn-lstm,sinovac,overall consider ppl age band take sinovac infer sinovac differ bad find efficacy sinovac bnt
@boosulyn @ayshardzn it’s pure discrimination and makes zero logical or scientific sense. We know vaccines do not stop spread of vaccine so how can MoH explain such a decision? It’s embarrassing and immoral. Majority of those people were told to take sinovac and now being punished ?,,cnn-lstm,sinovac,pure discrimination make logical scientific sense know vaccine begin spread vaccine moh explain decision embarrass immoral majority people told take sinovac punish
"RT @thevibesnews: PSA

Starting April 1, Sinovac recipients who have yet to receive booster shots will lose their fully-vaccinated status.…",,cnn-lstm,sinovac,psa start april sinovac recipient yet receive booster shot lose fullyvaccinated status
@chinIzumi These are overall ? Or just Sinovac ?,,cnn-lstm,sinovac,overall sinovac
"@tripperhead @cmhk258 The recent evidence seems pretty compelling that if you're receiving dose 1 or 2 and you're elderly it  shouldn't be Sinovac eh?
For those who had sinovac and first dose I wonder if BNT as second dose would enhance VE toward or beyond BNT #1?",,cnn-lstm,sinovac,recent evidence seem pretty compelling receive dose elderly differ sinovac sinovac first dose wonder bnt second dose would enhance toward beyond bnt
RT @facktura: Japan tak accept Sinovac vaccine recipients 😅😅,,cnn-lstm,sinovac,japan tak accept sinovac vaccine recipient
I Got my Sinovac Booster Shot and the Side Effects https://t.co/osy8DkgAep,,cnn-lstm,sinovac,get sinovac booster shot side effect
@tripperhead can't she accept that sinovac is one of the main reason we are failing dieting the 5th wave.,,cnn-lstm,sinovac,accept sinovac main reason fail diet wave
"@QuirkyPrincess I seeeee, i know some people have preference towards sinovac but I didn’t know the reason for it. Thanks for sharing 🥰",,cnn-lstm,sinovac,seeeee know people preference towards sinovac ignore reason thanks share
"@Thunder261 @RichardBarrow Some countries start to have higher cases numbers in the vaccinated poppulation so indeed vaccination status become irrelevant in a public health prospective.
When 1 year old sinovac is valid and recent novavax is not valid wtf.",,cnn-lstm,sinovac,country start high case number vaccinate poppulation indeed vaccination status become irrelevant public health prospective year old sinovac valid recent novavax invalid wtf
"@matt_1221_hk I think the main problem is some people will only get Sinovac. And if the media tells them it's no good, they just won't get vaccinated.",,cnn-lstm,sinovac,think main problem people get sinovac medium tell bad leave vaccinate
@tripperhead What’s so wrong with convincing people not to get Sinovac but BioNTech instead?,,cnn-lstm,sinovac,wrong convincing people get sinovac biontech instead
"@cmhk258 I think those in an RCHE that can't leave don't have a choice. Only Sinovac outreach teams atm. 

But I'm guessing, I can't remember exactly. I know if they're mobile and request it they can be taken to a BNT CVC.",,cnn-lstm,sinovac,think rche arrive refuse choice sinovac outreach team atm guess forget exactly know mobile request take bnt cvc
"RT @cnnphilippines: Studies show Sinovac’s COVID-19 vaccine is safe for children aged 3 to 5, but it cannot yet be administered to them loc…",,cnn-lstm,sinovac,study show sinovacs covid vaccine safe child age yet administer loc
"Around 2 million Sinovac recipients are at risk of
losing their fully vaccinated status, if they fail to get the jab by next Thursday.https://t.co/D0Lex2H7Ni",,cnn-lstm,sinovac,around sinovac recipient risk lose fully vaccinate status fail get jab next thursday
RT @YanzhongHuang: Two doses of Sinovac vaccine offered older people only a moderately high level of protection against severe disease and…,,cnn-lstm,sinovac,dos sinovac vaccine offer old people moderately high level protection severe disease
@hzqqqqq The Sinovac vaccine is given cause some people won't take if it's not sinovac at all...my friend's family is like that T_T The father believes the western vaccines will alter our DNA etc T_T,,cnn-lstm,sinovac,sinovac vaccine give people refuse sinovac allmy friend family like father believe western vaccine alter dna etc
"@newera2096 Per figures, 70% dead were not vaccinated; those dead but vaccinated *87%* had SINOVAC, not Biontech or others - 2022.3.20 Ming Pao https://t.co/4CHiByAsKG",,cnn-lstm,sinovac,per figure dead vaccinate dead vaccinate sinovac biontech others ming pao
"@XinqiSu angry?
what about the deaths who took Sinovac? 
what about their families and friends?",,cnn-lstm,sinovac,angry death take sinovac family friend
RT @dresmy: To all #Sinovac clan! Beware you are not allow to enter these countries for now (hopefully). @Visit_Japan Why oh why... https:/…,,cnn-lstm,sinovac,clan beware disallow enter country hopefully
@nextdoorsv For BioNTech. Hong Kong government was actually heavily promoting Sinovac.,,cnn-lstm,sinovac,biontech hong kong government actually heavily promote sinovac
#Sinovac my choice so no traveling for now to EU https://t.co/TqT0w5jt48,,cnn-lstm,sinovac,choice stayinplace
"Relevant to Malaysians only.

MySejahtera will be listed among apps accepted by EU members; M'sia to seek clarification on Sinovac recipients
https://t.co/3LMAYhvtsD",,cnn-lstm,sinovac,relevant malaysian mysejahtera list among apps accepted member msia seek clarification sinovac recipient
"@Khairykj https://t.co/JFliL4wzQf

Sinovac still protective. But with booster.",,cnn-lstm,sinovac,sinovac still protective booster
RT @ChinaScience: Three shots of China's #COVID19 #vaccine CoronaVac offer about 98% protection against death or severe illness in people a…,,cnn-lstm,sinovac,shot china coronavac offer protection death severe illness people
"Lam: Very angry, a few days ago, a local newspaper ran a headline that was misleading, and would convince people not to get Sinovac.

Have set clear targets to vaccinate the elderly. https://t.co/V6cuh01QDJ",,cnn-lstm,sinovac,lam angry day ago local newspaper ran headline mislead would convince people get sinovac set clear target vaccinate elderly
Sinovac suits from where it from,,cnn-lstm,sinovac,sinovac suit
@KKMPutrajaya @KKMPutrajaya Why make the people take sinovac in the first place and now plan to revoke their fully vaccinated status? on what account? Do you even take into consideration the general consequences of the recipient?,,cnn-lstm,sinovac,make people take sinovac first place plan revoke fully vaccinate status account even take consideration general consequence recipient
"Sinovac Boosters Provide Key Protection for Older People, New Study Finds.

Those who received Sinovac vaccines would be better served with a booster shots. 
 https://t.co/WKE5pBWzin",,cnn-lstm,sinovac,sinovac booster provide key protection old people new study find receive sinovac vaccine would well serve booster shot
BUZZ: 2 million Sinovac recipients are at risk of losing their fully vaccinated status if they don't get the booster shot by 1st April.,,cnn-lstm,sinovac,buzz sinovac recipient risk lose fully vaccinate status leave booster shot april
"Some 2 million Sinovac recipients are at risk of losing their fully vaccinated status if they don't get the booster shot by next Thursday. 

Both the Malaysian and Singporean govts have agreed that Sinovac recipients must receive 3 doses to be considered fully vaccinated",,cnn-lstm,sinovac,sinovac recipient risk lose fully vaccinate status leave booster shot next thursday malaysian singporean govts agree sinovac recipient must receive dos consider fully vaccinate
"RT @NurulYeoh: Definition of vaccination status from 1 April 2022.

#Sinovac #Covid19 #malaysia https://t.co/vlCgiUxPA2",,cnn-lstm,sinovac,definition vaccination status april
"shooting yourself in the foot for the betterment of others? @Khairykj 

Needed to prove the initial constraints to rakyat ie why sinovac

kih! nasib ko le labu...😝 https://t.co/YanOXJ33xA",,cnn-lstm,sinovac,shoot foot betterment others need prove initial constraint rakyat sinovac kih nasib labu
"Sinovac and Sinopharm recipients, get your booster shots. 
#Covid19 #malaysia https://t.co/A2sXZm4HoE",,cnn-lstm,sinovac,sinovac sinopharm recipient get booster shot
Seems Sinovac pulled the hugest april fools… https://t.co/yUGqHwzs0j,,cnn-lstm,sinovac,seem sinovac pull hugest april fool
"COVID-19 Boosters Provide Key Protection for People. Given the surge of Omicron cases in Asia, the new research lends urgency to vaccination campaigns in China and Hong Kong. #GetBoosted
https://t.co/wSlFpJERCF",,cnn-lstm,sinovac,covid booster provide key protection people give surge omicron case asia new research lends urgency vaccination campaign china hong kong
"Vaccination protects you, period. I feel sad having to write this down explicitly.

And that also means Sinovac, which is the popular vaccine for this age band, provides good protection from death. If u cannot get your vaccine hesitate grandpa to have BNT, 3X Sinovac isn’t bad. https://t.co/7gLG98FoxZ",,cnn-lstm,sinovac,vaccination protects period feel sad write explicitly also mean sinovac popular vaccine age band provide good protection death leave vaccine hesitate grandpa bnt sinovac goodness
"China-based Sinovac Biotech Ltd’s SVA.O COVID-19 vaccine was 38.2% effective in preventing infections during the Omicron wave in children aged three to five years.

https://t.co/QKiKIKNhS3",,cnn-lstm,sinovac,chinabased sinovac biotech ltds svao covid vaccine effective prevent infection omicron wave child age year
Get your booster shots everyone! #Sinovac #Malaysia https://t.co/8BtrgpinPl,,cnn-lstm,sinovac,get booster shot everyone
"Correct. My mom and dad are both Sinovac. After completing the shots, they developed rashes all over until now! Not all people can take the vaccines without side effects. Please be considerate towards people's health before mandatory everything. https://t.co/BBfxUHlR1k",,cnn-lstm,sinovac,correct mom dad sinovac complete shot developed rash partly people take vaccine without side effect please considerate towards people health mandatory everything
"now the other vaccines wouldn’t want to be friends with sinovac :&lt;
#stopbullying",,cnn-lstm,sinovac,vaccine would want friend sinovac
RT @HaramainInfo: The last dose of Johnson &amp; Johnson vaccine must have been administered at least 14 days prior to arrival into the Kingdom…,,cnn-lstm,sinovac,last dose johnson johnson vaccine must administer least day prior arrival kingdom
"RT @boosulyn: 1️⃣ countries that do require boosters for travelers only require it if your 2nd dose was &gt;7 to 9 months ago, unlike 🇲🇾 that…",,cnn-lstm,sinovac,country require booster traveler require dose month ago unlike
"RT @malaymail: Khairy: Two million set to lose fully vaccinated status on April 1, mainly Sinovac recipients https://t.co/RMEECb6fz8",,cnn-lstm,sinovac,khairy set lose fully vaccinate status april mainly sinovac recipient
"1️⃣ countries that do require boosters for travelers only require it if your 2nd dose was &gt;7 to 9 months ago, unlike 🇲🇾 that ignores date of 2nd dose 

2️⃣ 🇲🇾 practices vaccine / age discrimination instead by requiring booster for travelers with Sinovac/ Sinopharm or those ≥ 60yo. https://t.co/89lcizO7ch",,cnn-lstm,sinovac,country require booster traveler require dose month ago unlike ignores date dose practice vaccine age discrimination instead require booster traveler sinovac sinopharm
"Some two million Sinovac COVID-19 vaccine recipients are expected to lose their fully vaccinated status if they do not get a booster jab by April 1.
#Covid19 #Malaysia 

 https://t.co/SRHGhxLl9D",,cnn-lstm,sinovac,sinovac covid vaccine recipient expect lose fully vaccinate status leave booster jab april
"RT @hasifmoonryong: https://t.co/mbtUTxeWfe

No matter what you are. You will always be discriminated. In Malaysia, sinovaxers discriminate…",,cnn-lstm,sinovac,matter always discriminate malaysia sinovaxers discriminate
RT @NewsBFM: Two million people will lose their ‘fully vaccinated’ status by next Friday (April 1) if they do not receive a Covid-19 booste…,,cnn-lstm,sinovac,people lose fully vaccinate status next friday april sayfarewell covid booste
"@JamesMassard Two Sinovac last year, then this booster, so #3. Not getting a #4.",,cnn-lstm,sinovac,sinovac last year booster leave
@aftergI0ws oh yeah that’s why. almost everyone i know got side effects from the booster when their first two doses were sinovac. i didn’t get any side effects from my booster bc i was astra the first time,,cnn-lstm,sinovac,yeah almost everyone know get side effect booster first dos sinovac leave side effect booster astra first time
@aftergI0ws were you sinovac the first time?,,cnn-lstm,sinovac,sinovac first time
"@ayshardzn Generally 7-9 months from second dose. 

Malaysia requiring boosters for senior citizen / Sinovac or Sinopharm travelers regardless of when they took their second dose before entering 🇲🇾? 

So if an above-60 American got second dose just a month before departure, can’t visit 🇲🇾?",,cnn-lstm,sinovac,generally month second dose malaysia require booster senior citizen sinovac sinopharm traveler regardless take second dose enter american get second dose month departure visit
"RT @nytimesworld: The results highlighted the urgency for mainland China to accelerate its lagging booster campaign, health experts said. J…",,cnn-lstm,sinovac,result highlight urgency mainland china accelerate lag booster campaign health expert say
"RT @WilliamYang120: Additionally, a study released by scientists at HKU this week shows that two doses of China's Sinovac vaccines offer on…",,cnn-lstm,sinovac,additionally study release scientist hku week show dos china sinovac vaccine offer
"Additionally, a study released by scientists at HKU this week shows that two doses of China's Sinovac vaccines offer only a moderate level of protection against severe symptoms or death caused by coronavirus infection while a booster shot can enhance the protection significantly.",,cnn-lstm,sinovac,additionally study release scientist hku week show dos china sinovac vaccine offer moderate level protection severe symptom death cause coronavirus infection booster shot enhance protection significantly
"Hi ASEAN family

#NewsFromMalaysia🇲🇾

Khairy also mentioned that both the Malaysian &amp; Singapore governments have agreed that Sinovac recipients must get three vaccine doses to maintain their fully vaccinated status.🇲🇾

📄@malaymail 
 
#Malaysia #Covid19 #Vaccines #Endemic #Khairy https://t.co/op5gc6PmRU",,cnn-lstm,sinovac,asean family khairy also mention malaysian singapore government agree sinovac recipient must get vaccine dos maintain fully vaccinate status
"@Ana_KRamirez @Sinovac @Presidencia_Ec @Vice_Ec @Salud_Ec @ARCSA_CZ9 @ARCSA_CZ8 @ARCSA_CZ5 @ARCSA_CZ7 @ARCSA_CZ3 @ARCSA_CZ4 @ARCSA_CZ1 China will integrate freedom and democracy, simplify English, unite all countries to be United States of World.
Females will lead world.
Big Bang hypothesis will be overturned……

20 World Trends:
https://t.co/lwZDpaxtaO",,cnn-lstm,sinovac,china integrate freedom democracy simplify english unite country united state world female lead world big bang hypothesis overturn world trend
"Hi ASEAN Family

#NewsFromPhilippines🇵🇭

Sinovac’s #COVID19 vaccine was found to be safe &amp; effective against COVID-19 infection &amp; could provide protection against Delta &amp; Omicron variants to children as young as 3 years old.🇵🇭

📄@inquirerdotnet

#Vaccine

https://t.co/NWQKUNFhS9 https://t.co/ZYFOZcNoE3",,cnn-lstm,sinovac,asean family sinovacs vaccine found safe effective covid infection could provide protection delta omicron variant child young year old
"With recent surges in #China, concerns have arisen about potential high death rates particularly among the elderly. Since most of the population is vaccinated with #Sinovac and #Sinopharm which have shown to be less effective against #Omicron, vulnerable populations are at risk. https://t.co/SMmzo2WY16",,cnn-lstm,sinovac,recent surge concern arisen potential high death rate particularly among elderly since population vaccinate show less effective vulnerable population risk
"Some 2 million Sinovac recipients are at risk of losing their fully vaccinated status if they don't get the booster shot by next Thursday. 

@Khairykj says both the Msian and S'porean govts have agreed that Sinovac recipients must receive 3 doses to be considered fully vaccinated https://t.co/dh7ZYy7pZH",,cnn-lstm,sinovac,sinovac recipient risk lose fully vaccinate status leave booster shot next thursday say msian sporean govts agree sinovac recipient must receive dos consider fully vaccinate
"VE = Vaccine Effectiveness against death

Data is based on age 80+ vaccination data up to March 24 20:00, age 80+ deaths during 5th wave up to March 24 00:00, all provided by the CHP

(And, no, I don’t have the latest Sinovac/BioNTech data)",,cnn-lstm,sinovac,vaccine effectiveness death data base age vaccination data march age death wave march provide chp refuse late sinovacbiontech data
"Weird if 🇲🇾 is imposing 3-dose requirement on primed Sinovac travellers and travellers aged 60 years and above. 

Even 🇸🇬 uses standard 2 doses across all double-dose vaccines for quarantine-free entry into Singapore. 

Haven’t heard of any country requiring 3 doses for travel. https://t.co/hT3exoNws0 https://t.co/JV2TKJq8bs",,cnn-lstm,sinovac,weird impose dose requirement prim sinovac traveller traveller age year even standard dos across doubledose vaccine quarantinefree entry singapore heard country require dos travel
"1. MySejahtera will soon be among the apps to be accepted by the European Union as proof of vaccination.

However, Health Minister Khairy Jamaluddin says he will seek further clarification from the EU delegation in Malaysia on Sinovac not being recognised by some member states. https://t.co/g3Ms09UJhF",,cnn-lstm,sinovac,mysejahtera soon among apps accepted european union proof vaccination however health minister khairy jamaluddin say seek clarification delegation malaysia sinovac nonbeing recognise member state
Sinovac recipient is not eligible to travel to Japan. Cry in silent,,cnn-lstm,sinovac,sinovac recipient ineligible travel japan cry silent
"About two million #Sinovac vaccine recipients are at risk of losing their fully vaccinated status on April 1, Health Minister Khairy Jamaluddin said. https://t.co/0ZM1HrbVOi",,cnn-lstm,sinovac,vaccine recipient risk lose fully vaccinate status april health minister khairy jamaluddin say
@bernamadotcom @Khairykj @KKMPutrajaya Doesn't make much sense for kkm to do that as kkm was the one that approved &amp; pushed the people to take sinovac as the primary vaccine!!! Were there many death cases due to Covid-19 for people who had taken sinovac as primary vaccines!!!,,cnn-lstm,sinovac,unmake much sense kkm kkm approve push people take sinovac primary vaccine many death case due covid people take sinovac primary vaccine
"Sinovac’s COVID-19 vaccine was found to be safe and effective against COVID-19 infection and could provide protection against the Delta and Omicron variants to children as young as 3 years old.

Read: https://t.co/szAmwROHHd https://t.co/2ySW98oLTw",,cnn-lstm,sinovac,sinovacs covid vaccine found safe effective covid infection could provide protection delta omicron variant child young year old read
"Two doses is considered as fully vaccinated, the booster shot is to continue protect from COVID-19
Why must we loose our fully vaccinated status??????

Covid-19: Two million Sinovac recipients set to lose fully vaccinated status, says KJ https://t.co/1zve4jWW2T",,cnn-lstm,sinovac,dos consider fully vaccinate booster shot continue protect covid must loose fully vaccinate status covid sinovac recipient set lose fully vaccinate status say
@staronline Why are you punishing sinovac recipients but not others? Are you saying others are immune?,,cnn-lstm,sinovac,punish sinovac recipient others say others immune
RT @jegathink: Two paths now laid in front of them. First go and retake the initial shots from 'approved' brands. Or see the demeaning natu…,,cnn-lstm,sinovac,path laid front first retake initial shot approve brand see demean natu
"RT @hildabast: ...For 2 inactivated vaxes (CoronaVac, Covaxin) immune response might be higher in kids; Soberana (protein subunit) might be…",,cnn-lstm,sinovac,inactivate vaxes coronavac covaxin immune response might high kid soberana protein subunit might
"@brianlian Yea… when’s my fourth dose..? If I were to even pay for my fourth dose, I can only get Sinovac.",,cnn-lstm,sinovac,yea fourth dose even pay fourth dose get sinovac
RT @JShijiu: @FalunSchlong Those who refused to mask up and fight vaccination along with other covid measures played an active role in kill…,,cnn-lstm,sinovac,refuse mask fight vaccination along covid measure played active role kill
@FalunSchlong Those who refused to mask up and fight vaccination along with other covid measures played an active role in killing elderlies in HK. Media who actively exaggerated side effects and degraded Sinovac’s high efficacy vs severe infections and deaths have blood on their hands too!,,cnn-lstm,sinovac,refuse mask fight vaccination along covid measure played active role kill elderly medium actively exaggerated side effect degrade sinovacs high efficacy severe infection death blood hand
"RT @aqilalmashoor: Sinovac tengah trending?? 

Tees with vaccine related brands are open for pre-order. 

#parodyartshirt https://t.co/FMvV…",,cnn-lstm,sinovac,sinovac tengah trend tee vaccine related brand open preorder
Sinovac’s COVID-19 vaccine was found to be safe and effective against COVID-19 infection and could provide protection against the Delta and Omicron variants to children as young as 3 years old. | @kdevillaINQ /PDI https://t.co/txWQWgcQSt,,cnn-lstm,sinovac,sinovacs covid vaccine found safe effective covid infection could provide protection delta omicron variant child young year old pdi
"Can the ministers (both Malaysian and Singaporean) please show us the science behind this decision? If you don't, I will assume you have been co-opted by the White supremacists.  https://t.co/wu9YxJn826",,cnn-lstm,sinovac,minister malaysian singaporean please show science behind decision assume coopted white supremacist
"@RavensVu Sinovac is none mrna, least immediate potential damage, long term effect unknown.",,cnn-lstm,sinovac,sinovac none mrna least immediate potential damage long term effect unknown
RT @JFernandeznino: Colombia has a very diverse portfolio of vaccines against covid. Esperanza  is one of the few cohort studies that evalu…,,cnn-lstm,sinovac,colombia diverse portfolio vaccine covid esperanza cohort study evalu
