text,sentiment,model,topic,cleaned
@my_sejahtera Is Sinovac booster jab counted?,,cnn-lstm,sinovac,sinovac booster jab count
"@DoombergT Zeihan talked about this.

Sinovac doesn't work",,cnn-lstm,sinovac,zeihan talk sinovac idle
"@CohoKelly the “if” is doing a lot of work there lmao - no one believes this data. and, if we did, there’s no way that if omicron is in shanghai (combined the the less effective sinovac vax) they’re not going to have a huge wave",,cnn-lstm,sinovac,lot work lmao unbelief data way omicron shanghai combine less effective sinovac vax come huge wave
"@ImTiredBoss @beagoddamnadul1 @Gab_H_R @bobbiet1001 Their vaccine doesn't work for the new variants. I don't think they vaccinate at all with mRNA jabs.

https://t.co/upEwRQONk7",,cnn-lstm,sinovac,vaccine idle new variant forget vaccinate mrna jab
@trishankkarthik @nntaleb Both BioNTech and Sinovac have been freely available in Hong Kong since the beginning of the vaccination campaign,,cnn-lstm,sinovac,biontech sinovac freely available hong kong since begin vaccination campaign
"@PersianCapital @JustOneStock China has a birth rate below 1, a massive real estate bubble, à covid crisis that hasn’t exploded yet with 1.1Bn people vaccinated with an ineffective Sinovac. 

So if you want to check China’s trajectory for the next 20 years, think Japan in the 1990s.",,cnn-lstm,sinovac,china birth rate massive real estate bubble covid crisis implode yet people vaccinate ineffective sinovac want check china trajectory next year think japan
"@ASlavitt The Sinovac vaccine is also less effective. But yes, no problem is to big to ignore.",,cnn-lstm,sinovac,sinovac vaccine also less effective yes problem big ignore
"@VSoien Zeihan talked about this extensively.
Sinovac is sht vaccine.

They HAVE to do lock downs else a LOT of people die.",,cnn-lstm,sinovac,zeihan talk extensively sinovac sht vaccine lock down else lot people die
@Marco_Piani Hot mess. Any decent data on if Sinovac even works? https://t.co/jy1kY6p4Rv,,cnn-lstm,sinovac,hot mess decent data sinovac even work
@mdsynic looks like not only sinovac is the prob. This may even  be just a bit worse. https://t.co/vfpXQiaawg,,cnn-lstm,sinovac,look like sinovac prob may even bit bad
RT @rodbishop15: Madness. But then the #Sinovac vaccine was a disaster.,,cnn-lstm,sinovac,madness vaccine disaster
@psychoticdream1 @covidstrike @hjelle_brian @stephenfirvulag Better than 0.5-2 million hospitalizations (iirc Sinovac is less protective...though would be glad to be wrong).,,cnn-lstm,sinovac,well hospitalization iirc sinovac less protectivethough would glad wrong
China’s widely used Sinovac vaccines are inferior to mRNA vaccines; the country’s zero tolerance covid policy means natural immunity is almost nonexistent there too. This leaves China vulnerable to surges + lockdowns. Means lots of implications for global supply chain &amp; inflation https://t.co/j6xxRKw014,,cnn-lstm,sinovac,china widely use sinovac vaccine inferior mrna vaccine country tolerance covid policy mean natural immunity almost nonexistent leaf china vulnerable surge lockdown mean lot implication global supply chain inflation
@fuIImoon__ @trishankkarthik @nntaleb thailand and indonesia ditched sinovac as not effective.,,cnn-lstm,sinovac,thailand indonesia ditch sinovac ineffective
"@my_sejahtera Dear Sir or Madam, you are the person that brings in the Sinovac not we the people. Why is it considered as not fully vasinated? If you guys should stop rather than brought that in earlier for vaccine all the people here in Malaysia!!!",,cnn-lstm,sinovac,dear sir madam person brings sinovac people consider meagerly vasinated guy stop rather brought earlier vaccine people malaysia
@andyaschmidt @hjelle_brian I think it's going to hammer their elderly population first followed by immunocompromised caretakers. Same as here. Big question is how does SinoVac hold up to these variants and what has been their booster policy. Then deaths a year from now will appear to have dropped.,,cnn-lstm,sinovac,think hammer elderly population first follow immunocompromised caretaker big question sinovac hold variant booster policy death year appear drop
"RT @LaurenWern: From what I understand, Hong Kong has a way lower vaccination rate among its elders. Only about 37% of those over 80 years…",,cnn-lstm,sinovac,understand hong kong way low vaccination rate among elder year
"To conclude, Sinovac vaccines are effective against Omicron for olders as well as against Delta.  But one of  differences between Omicron and Delta is more transmissible for youngers.

Do vaccines produced by Sinopharm keep effectiveness against Omicron for adolescences?",,cnn-lstm,sinovac,conclude sinovac vaccine effective omicron olders well delta difference omicron delta transmissible youngers vaccine produce sinopharm keep effectiveness omicron adolescence
@trishankkarthik @nntaleb I'm talking about other nations that use Sinovac and have the pandemic under control. My country for example.,,cnn-lstm,sinovac,talk nation use sinovac pandemic control country example
@trishankkarthik @nntaleb False. Stop looking only at China when Sinovac is concerned. Sinovac was used all over the world and the cases are under control in the majority of those nations.,,cnn-lstm,sinovac,false stop look china sinovac concerned sinovac use world case control majority nation
Sinovac vaccines are not mRNA one.  Therefore those who don't trust mRNA technology would like.  It is trigger whether Sinovac vaccines are effective against Omicron or not.,,cnn-lstm,sinovac,sinovac vaccine mrna one therefore mistrust mrna technology would like trigger whether sinovac vaccine effective omicron
@carmen_nephthys @Seeker1Freedom Then get the j&amp;j viral vector vaccine. Or the inactive one Sinovac,,cnn-lstm,sinovac,get viral vector vaccine inactive sinovac
@EdmundKudzayi @aravindmc Thanx most pipo got vaccinated pa second wave when it the virus was too serious... my observation from those tht i know who have been vaccinated sofar hapana ati arwara from sinopharm n sinovac..we pray it stays likes this,,cnn-lstm,sinovac,thanx pipo get vaccinate second wave virus serious observation tht know vaccinate sofar hapana ati arwara sinopharm sinovac pray stay like
RT @interaksyon: China-based Sinovac Biotech Ltd’s SVA.O COVID-19 vaccine was 38.2% effective in preventing infections during the Omicron w…,,cnn-lstm,sinovac,chinabased sinovac biotech ltds svao covid vaccine effective prevent infection omicron
"I stand with this side.
Sinovac ‘modest’ defence against Omicron in children 
17 March 2022
https://t.co/BWkn1ZNeEO",,cnn-lstm,sinovac,stand side sinovac modest defence omicron child march
RT @inquirerdotnet: Sinovac’s COVID-19 vaccine was found to be safe and effective against COVID-19 infection and could provide protection a…,,cnn-lstm,sinovac,sinovacs covid vaccine found safe effective covid infection could provide protection
"Sinovac Boosters Provide Key Protection for Older People, New Study Finds https://t.co/zdkC9GqpHq",,cnn-lstm,sinovac,sinovac booster provide key protection old people new study find
RT @staronline: About two million recipients of the Sinovac vaccine are set to lose their fully vaccinated status if they do not receive th…,,cnn-lstm,sinovac,recipient sinovac vaccine set lose fully vaccinate status sayfarewell
@alexmeshkin China’s COVID vax campaign using their own less effective Sinovac/Coronavac rather than importing more effective expensive mRNA vaccines was probably a bet that they could avoid large scale outbreak by strict public health protective measures. But Omicron broke through that wall.,,cnn-lstm,sinovac,china covid vax campaign use less effective sinovaccoronavac rather import effective expensive mrna vaccine probably bet could avoid large scale outbreak strict public health protective measure omicron broke wall
"@NordickChad Trading partners ≠ healthy GDP
China's property economy is crashing by 72%
CCP struggles with Omicron and sinovac.
Resulting in more lockdowns
Which affects industry, employment and healthcare to name few.
Not to mention CCP fabricates data.

Kvetch about sources more.",,cnn-lstm,sinovac,trading partner healthy gdp china property economy crash ccp struggle omicron sinovac result lockdown affect industry employment healthcare name mention ccp fabricates data kvetch source
"@Amine19O @Seggitorial The arguement in favour of mRNA vaccines is they have better VE after 1 or 2 doses than sinovac, so certainly makes sense to use sinovax to boost those who already have sinovax. But for those with 0 or 1 doses, switching to BioNtech will build immunity faster.",,cnn-lstm,sinovac,arguement favour mrna vaccine well dos sinovac certainly make sense use sinovax boost already sinovax dos switch biontech build immunity faster
@BachSimon @sgy1991 @BBCWorld They exported sinovac which is useless. Might as well drink orange juice,,cnn-lstm,sinovac,export sinovac useless might well drink orange juice
@CDlbcl @Seggitorial Yes. Fully vaccinated = 2 doses (mainly sinovac and Sinopharm). Booster rates are low. And yes they need booster because the vast majority got their second doses almost a year ago. https://t.co/NZSSVw0pde,,cnn-lstm,sinovac,yes fully vaccinate dos mainly sinovac sinopharm booster rate low yes need booster vast majority get second dos almost year ago
"@matthewstoller #SinoVac hasn’t worked and it would be hard for them to swallow their pride and admit failures. For all his faults, #Trump’s warp speed development of #Vaccines helped America and Europe immensely.",,cnn-lstm,sinovac,idle would hard swallow pride admit failure fault warp speed development help america europe immensely
"$TSLA earned 102% of its 2021 profits in China. 

A Yale study in October found that Sinovac is ineffective against Omicron. 

$TSLAQ https://t.co/Slk3pdypeM",,cnn-lstm,sinovac,tsla earn profit china yale study october found sinovac ineffective omicron tslaq
@kbaodejing There is a Lancet study which says those who took Sinovac vaccination shots No. 2 should wait longer than 3 months before they proceed to get the booster. https://t.co/TDdN0c5iNq,,cnn-lstm,sinovac,lancet study say take sinovac vaccination shot wait longer month proceed get booster
"The #HongKong Special Administrative Region government has shot down a local news media report that doubts the efficacy of the CoronaVac COVID-19 #vaccine (#Sinovac), denouncing it as “misleading”.
https://t.co/TOaWPFZa9C https://t.co/IW5tussHkA",,cnn-lstm,sinovac,special administrative region government shot local news medium report doubt efficacy coronavac covid denounce mislead
"Did they do one on @sputnikvaccine and #sinovac ?

Ooh there is #TURKOVAC too. https://t.co/6qKrbULwli",,cnn-lstm,sinovac,ooh
"@MrTeslaX @TeslaSg I think so with low efficacy of sinovac otherwise I cannot think of a valid reason.

Moreover, hk is a good example with many deaths (likely to be vaccinated by sinovac)",,cnn-lstm,sinovac,think low efficacy sinovac otherwise forget valid reason moreover good example many death likely vaccinate sinovac
"@crushspread @JDMayger @JamiePastore9 Based on the extremely small sample set from SG across 2 inactivated and 2 mRNA vaccines, and data from large sample sets everywhere else, Sinopharm is a materially better vaccine than Sinovac so 3x vaxxed you are fine",,cnn-lstm,sinovac,base extremely small sample set across inactivate mrna vaccine data large sample set everywhere else sinopharm materially well vaccine sinovac vaxxed fine
"@crushspread @JamiePastore9 I think that was data on Sinovac, not Sinopharm. Maybe there’s little difference? I certainly hope so, as someone who’s had 3 shots of Sinopharm’s vaccine.",,cnn-lstm,sinovac,think data sinovac sinopharm maybe little difference certainly hope someone shot sinopharms vaccine
@ScienceWDrDoug @ProfessorWerner is there any data on sinovac?,,cnn-lstm,sinovac,data sinovac
"#BodohSendiri! 🙄

The Star Online: Covid-19: No legal action against Sinovac vaccine recipients who refuse boosters, says KJ.
https://t.co/T46EJq3Hsu

via @GoogleNews",,cnn-lstm,sinovac,star online covid illegal action sinovac vaccine recipient refuse booster say via
maybe bcs the first n the second dose is sinovac,,cnn-lstm,sinovac,maybe bcs first second dose sinovac
@nako_mintchoco Japan didnt accept sinovac... 😭😭😭😭😭😭😭😭😭,,cnn-lstm,sinovac,japan refuse sinovac
"Check out our weekly wrap.

1. Covid-19: Two million Sinovac recipients set to lose fully vaccinated status, says KJ
https://t.co/1csq0igyA2",,cnn-lstm,sinovac,check weekly wrap covid sinovac recipient set lose fully vaccinate status say
"RT @NYTScience: The results highlighted the urgency for mainland China to accelerate its lagging booster campaign, health experts said. Jus…",,cnn-lstm,sinovac,result highlight urgency mainland china accelerate lag booster campaign health expert say jus
"#ScienceInProgress I think ""Healthy-vaccinated effect"" #bias discussed by #HKU Prof. @gmleunghku+key biases discussed above #MORE than Gabriel et al #HKU have taken account &amp; #adjust/#correct 4when comparing effectiveness of #Sinovac v #BioNTech https://t.co/ikBYHCVpIS #DataBias",,cnn-lstm,sinovac,think healthyvaccinated effect discuss prof bias discuss gabriel take account compare effectiveness
ALL Sinovac + Sinopharm Recipients MUST Get Booster Dose! https://t.co/GmcrenZ6mX,,cnn-lstm,sinovac,sinovac sinopharm recipient must get booster dose
RT @CCGBelfast: Three shots of China's #COVID19 #vaccine CoronaVac offer about 98% protection against death or severe illness in people age…,,cnn-lstm,sinovac,shot china coronavac offer protection death severe illness people age
"The #push/#promo by #HongKong gov for general &amp; elderly use of #Sinovac(#CoronaVac) is major. And then for nursing homes to push for / making vax using #Sinovac so much easier (vax by in-NH doc) than #BioNTech(#Comirnaty) (u book your own apt, transport &amp; isolate after). 2/n",,cnn-lstm,sinovac,gov general elderly use major nursing home push make vax use much easy vax innh doc book apt transport isolate
"There should be (if not already) #NEJM #Lancet etc articles documenting/analyzing how #beep up #HongKongers elderly vax strategies have been (&amp; still #beeping are).
And I want #HKU researchers 2admit how #biased for #Sinovac(#CoronaVac)&amp; against #BioNTech(#Comirnaty)! [HT Karen] https://t.co/GpguqqvbUk https://t.co/beQNal9NL0",,cnn-lstm,sinovac,already etc article documentinganalyzing elderly vax strategy still want researcher admit karen
@Khairykj YB why takde option for sinovac booster for teenagers? My children both vac 1 &amp; 2 sinovac. I insist on sinovac for their booster. Hope u can look into this matter for parents to choose preferred booster. Tq,,cnn-lstm,sinovac,takde option sinovac booster teenager child vac sinovac insist sinovac booster hope look matter parent choose prefer booster
@RotiWiraceo444 UK recognized Sinovac,,cnn-lstm,sinovac,recognize sinovac
"RT @KaiserKuo: Fascinating. Meshes what I've heard from HK folks as to why it hit so hard. Others, however, have said there's a political e…",,cnn-lstm,sinovac,fascinate mesh heard folk hit hard others however say political
@CSMIA_Official very urgent ...my friend has been asked to not board Malaysia Airlines flight to India as he has sinovac vaccine as per the latest circular...say came out today 27th march . Can you confirm?,,cnn-lstm,sinovac,urgent friend ask getoff malaysia airline flight india sinovac vaccine per late circularsay come today march confirm
"@Khairykj @KKMPutrajaya Mr KJ..Please Clarify
Which Countries not recognized Sinovac Vaccine. 
@KKMPutrajaya",,cnn-lstm,sinovac,please clarify country recognize sinovac vaccine
"kay senator RISA hontiveroSS, patay ang virus. 

Inactivated viral vaccines:
&gt;Rabies
&gt;Influenza (shot)
&gt;Salk polio
&gt;hepatitis A
&gt;Sinovac
&gt;Sinopharm",,cnn-lstm,sinovac,kay senator risa hontiveross patay ang virus inactivate viral vaccine rabies influenza shot salk polio hepatitis sinovac sinopharm
@AiSimonThompson @Academic_owl @AdamJKucharski We don’t use Sinovac in the UK. The vaccines we do use are still extremely effective at massively reducing severe disease and death from covid. That message should not be being undermined with people making out that masks and SD are a better option.,,cnn-lstm,sinovac,use sinovac vaccine use still extremely effective massively reduce severe disease death covid message differ undermined people make mask well option
"@AngryAnn4 @Kit_Yates_Maths I agree with all of that. I have a close friend in HK. Their death rate is due to vacc hesitancy among the elders, and reliance on Sinovac.

Really disciplined use of N95s and social distancing (eg, no eating or drinking with others) will postpone catching BA.2",,cnn-lstm,sinovac,agree close friend death rate due vacc hesitancy among elder reliance sinovac really discipline use social distance eat drinking others postpone catch
"RT @kuabt: Covid-19: No legal action against Sinovac vaccine recipients who refuse boosters, says KJ https://t.co/ZUetSgI4Gf
Wow!!!!!",,cnn-lstm,sinovac,covid illegal action sinovac vaccine recipient refuse booster say wow
"A study of University of Hong Kong revealed that three shots of CoronaVac offered appromixtely 98% protection against death or severe illness in those over 60 years old.

#Sinovac #COVID19 

https://t.co/ffRlqCbqMV",,cnn-lstm,sinovac,study university hong kong reveal shot coronavac offer appromixtely protection death severe illness year old
"RT @XHNews: #Xiconomics: How people-centered philosophy navigates China's high-quality growth, common development https://t.co/6TiDPYaFvP h…",,cnn-lstm,sinovac,peoplecentered philosophy navigates china highquality growth common development
"RT @EricTopol: Combined Covid and flu is twice as deadly and 4-fold more need for mechanical ventilation than Covid alone
https://t.co/lw2W…",,cnn-lstm,sinovac,combine covid flu twice deadly fold need mechanical ventilation covid alone
"RT @EricTopol: New and important report on the 2nd booster
Reduction of death for people age 60+
A 78% reduction of death due to Covid in ~…",,cnn-lstm,sinovac,new important report booster reduction death people age reduction death due covid
"RT @LowyatNET: Two Million #Sinovac Recipients Set To Lose Fully Vaccinated Status Next Week

https://t.co/m4UqDcfS2B https://t.co/Vjk3Hytk…",,cnn-lstm,sinovac,recipient set lose fully vaccinate status next week
Hong Kong started out their Omicron wave with ~2/3rds of the population having some level of immunity due to their not-so-great Sinovac vaccine. One really wonders how much worse an Omicron wave would be hitting a population with no prior immunity for the first time.,,cnn-lstm,sinovac,hong kong start omicron wave rds population level immunity due notsogreat sinovac vaccine really wonder much bad omicron wave would hit population prior immunity first time
"RT @NewsBFM: 1. MySejahtera will soon be among the apps to be accepted by the European Union as proof of vaccination.

However, Health Mini…",,cnn-lstm,sinovac,mysejahtera soon among apps accepted european union proof vaccination however health mini
"My aunt received her Sinovac booster late January at a Penang private hospital but the booster status is still not reflected in MySejahtera.

While she has a copy of the Pharmaniaga issued record, will this affect her vaccination status come 1st April?

@my_sejahtera @Khairykj https://t.co/8MrIbpsGkB",,cnn-lstm,sinovac,aunt receive sinovac booster late january penang private hospital booster status still unreflected mysejahtera copy pharmaniaga issue record affect vaccination status come april
Pilot quaxxinated with Sinovac? https://t.co/O58ERBhyvP,,cnn-lstm,sinovac,pilot quaxxinated sinovac
"@mdccp2020 @mikepompeo Sinovac Biotech Ltd. is the largest manufacturer of Covid 19 vaccine in China. Although Kexing vaccines are frequently exposed to efficiency problems, in the first quarter of this year alone, the vaccine created a net profit of 10 billion yuan 1.67 billion US dollars for Kexing",,cnn-lstm,sinovac,sinovac biotech ltd large manufacturer covid vaccine china although kexing vaccine frequently expose efficiency problem first quarter year alone vaccine create net profit yuan dollar kexing
@EthantheFlaneur How bad is Sinovac?,,cnn-lstm,sinovac,bad sinovac
@DonEford What makes some ppl still be careful/alert w/pandemic situation even after 3 RNA vacc? Not common physiological reaction? What about Sinovac? Ppl in my homeland seemed even more careless after 3 Sinovac too,,cnn-lstm,sinovac,make ppl still carefulalert wpandemic situation even rna vacc uncommon physiological reaction sinovac ppl homeland seem even careless sinovac
"@drkalai61 @ICR_NIH @hkumed @DGHisham @maheshappannan 

@BharatBiotech Covaxin more effective &amp; efficacious compared to Sinovac during trials.
@BharatBiotech must further enhance the efficacy of Covaxin to meet the current pandemic challenges.
👍🏻 as yearly Vaccination dose if available.",,cnn-lstm,sinovac,covaxin effective efficacious compare sinovac trial must enhance efficacy covaxin meet current pandemic challenge yearly vaccination dose available
"3d doses of either BioNTech or SinoVac provide substantial additional protection against severe COVID-19 and should be prioritized, esp in older adults who received CoronaVac before. by @bencowling88 et al https://t.co/ehMwswmDfA",,cnn-lstm,sinovac,dos either biontech sinovac provide substantial additional protection severe covid prioritize esp old adult receive coronavac
Receivers of CoronaVac/Sinovac with significantly reduced antibodies may face higher risk to pandemic breakthrough infections. Sinovac recipients need a 3d jab of BionTech. https://t.co/oKm7l0kXiI https://t.co/ufcJbRzViz,,cnn-lstm,sinovac,receiver coronavacsinovac significantly reduce antibody may face high risk pandemic breakthrough infection sinovac recipient need jab biontech
@erinotoole Lol ludicrous ! Have they even checked out every shareholder of every other Vaccinne manufacturer? There must be a link to China on this one. Canada probably did not admit CHINESE into the country vaccinated with Sinovac so this is payback via the WHO which they control.,,cnn-lstm,sinovac,lol ludicrous even checked every shareholder every vaccinne manufacturer must link china one canada probably deny chinese country vaccinate sinovac payback via control
"@SarahSpencerTW @AnneW12619455 @ASlavitt Lots of elderly HKers are scared of potential side effects of mRNA vaccines, and took the Sinovac even when they knew it's much less effective, simply because of lower side effects.

When COVID didn't kill, people became much more concerned with the vaccines' side effects.",,cnn-lstm,sinovac,lot elderly hkers scar potential side effect mrna vaccine take sinovac even knew much less effective simply low side effect covid kill people become much concerned vaccine side effect
"@KaiserKuo Sinovac booster turned out to be fairly effective in preventing serious cases, if people only were willing to get the booster. 
https://t.co/y5IITpdb4g",,cnn-lstm,sinovac,sinovac booster turn fairly effective prevent serious case people willing get booster
@KaiserKuo Plenty of vaccine misinformation re: Sinovac from pro-West HK doctors and medical service providers.,,cnn-lstm,sinovac,plenty vaccine misinformation sinovac prowest doctor medical service provider
RT @wasabi1388: @bernamadotcom @Khairykj @KKMPutrajaya Doesn't make much sense for kkm to do that as kkm was the one that approved &amp; pushed…,,cnn-lstm,sinovac,unmake much sense kkm kkm approve push
"@andkenbr @PaigePang1 @EricTopol Yea, apparently 2-dose moderately effective booster very effective. Two doses offered older people only a moderately high level of protection against severe disease and death, but a third dose significantly bolstered their defenses. https://t.co/nTI2puLIAE",,cnn-lstm,sinovac,yea apparently dose moderately effective booster effective dos offer old people moderately high level protection severe disease death third dose significantly bolster defense
"Sinovac COVID vaccine 38% effective in young kids —Chilean study

READ HERE: https://t.co/XAKpI8IJzv https://t.co/dCJmGkmUhd",,cnn-lstm,sinovac,sinovac covid vaccine effective young kid chilean study read
"@SpikeHK He is not totally wrong.
Sinovac, one of the two available vaccines in HK, is dangerous &amp; ineffective against Delta/omicron.",,cnn-lstm,sinovac,partly wrong sinovac available vaccine dangerous ineffective deltaomicron
"@KaiserKuo Distrust of both Sinovac and Biontech, after they were rolled out they both received tons of bad press re: side-effects, and little was done to promote their uptake due to the gov focus on purging the civil service/district councils/legco/schools post-2019",,cnn-lstm,sinovac,distrust sinovac biontech roll receive ton bad press sideeffects little promote uptake due gov focus purge civil servicedistrict councilslegcoschools post
"@AnneW12619455 @ASlavitt Im in Taiwan, not HK. But we couldn’t purchase, beg steal or borrow MRNA vaccine until fall 2021. All we had was donated AZ  and that was in short supply. There are other issues in HK bc of Chinas preference for Sinovac. But many places couldn’t get MRNA for a long time.",,cnn-lstm,sinovac,taiwan could sell beg steal borrow mrna vaccine fall donate short supply issue china preference sinovac many place could leave mrna long time
"@packerpoppa @PaigePang1 @EricTopol Three doses of Sinovac seems to be very effective against hospitalization, even against Omicron. The problem is not there, not yet. https://t.co/x2jPzTWONB",,cnn-lstm,sinovac,dos sinovac seem effective hospitalization even omicron problem yet
