text,sentiment,model,topic,cleaned
@therakyatpost @KKMPutrajaya KKM should ensure Sinovac primary with Pfrizer booster accepted in EU,,cnn-lstm,sinovac,kkm ensure sinovac primary pfrizer booster accepted
"Alert to China because their data shows Sinovac vaccine is becoming less effective for the elderly.
https://t.co/jlACbSTnvC",,cnn-lstm,sinovac,alert china data show sinovac vaccine become less effective elderly
"Data indicating the #Sinovac Biotech Ltd. Covid-19 vaccine is less effective than an mRNA vaccine at preventing death in elderly people in Hong Kong is a red flag for mainland #China.
https://t.co/cYVnBgZ4Ek",,cnn-lstm,sinovac,data indicate biotech ltd covid vaccine less effective mrna vaccine prevent death elderly people hong kong red flag mainland
"Alert for #China as data reveals Sinovac vaccine less effective for elderly.
https://t.co/YIoUuj2Ajq",,cnn-lstm,sinovac,alert data reveals sinovac vaccine less effective elderly
@MarioRatzenber1 @ojblanchard1 N nucleocapsid protein provides better stimulation of long term T cellular immunity which is crucial in preventing death and serious illness. The timing of the vaccine is more important. Repeated boosters are needed for mRNA and DNA vaccines.sinovac need to be well space out,,cnn-lstm,sinovac,nucleocapsid protein provide well stimulation long term cellular immunity crucial prevent death serious illness timing vaccine important repeat booster need mrna dna vaccinessinovac need well space
"Alert for #China as data reveals #Sinovac vaccine less effective for elderly,where only half of the population aged 80 and older are fully vaccinated.   https://t.co/9a9ITFXOs4",,cnn-lstm,sinovac,alert data reveals vaccine less effective elderly half population age old fully vaccinate
@MarioRatzenber1 @ojblanchard1 Sinovac or any inactivated vaccinee do not multiply billion times in your body. Low antigenic load produce lower antibodies but LOWER serious adverse effects. Sinovac cellular immunity takes months to mature. It's effects come on much later compare to mRNA vaccines.,,cnn-lstm,sinovac,sinovac inactivate vaccinee singly time body low antigenic load produce low antibody low serious adverse effect sinovac cellular immunity take month mature effect come much later compare mrna vaccine
"Alert for China as data reveals Sinovac vaccine less effective for elderly,where only half of the population aged 80 and older are fully vaccinated.   https://t.co/sNTQ4bFfmz",,cnn-lstm,sinovac,alert china data reveals sinovac vaccine less effective elderly half population age old fully vaccinate
@MarioRatzenber1 @ojblanchard1 mRNA vaccines multiply billion folds in your body. Higher antigenic load stimulate higher antibodies level but it doesn't last. Inactivated whole virus vaccine stimulate cellular immunity which last longer and can recognise variants over longer term. Sinovac dose 3 microgram,,cnn-lstm,sinovac,mrna vaccine multiply fold body high antigenic load stimulate high antibody level first inactivate whole virus vaccine stimulate cellular immunity last longer recognise variant longer term sinovac dose microgram
"A breakdown of the deaths in HK by VACCINE TYPE and age.

Rough conclusion: 
Vaccines prevent deaths. 
BioNTech also reduces severity. 
💉💉💉Best - Get boosted if you can

One caveat: Sinovac may be more popular in the elderly groups with comorbidities. https://t.co/hN5rS033q8 https://t.co/0pZd5tz9re",,cnn-lstm,sinovac,breakdown death vaccine type age rough conclusion vaccine prevent death biontech also reduces severity best get boost caveat sinovac may popular elderly group comorbidities
"@MarioRatzenber1 @ojblanchard1 Let me answer your question. Sinovac is an inactivated virus. It contains all the full breath of the virus protein. Spike , nucleocapsid ,membrane and orf and other non structural proteins. mRNA vaccines give you higher doses of antibodies against spike proteins only.",,cnn-lstm,sinovac,let answer question sinovac inactivate virus contains full breath virus protein spike nucleocapsid membrane orf non structural protein mrna vaccine give high dos antibody spike protein
"Sinovac's CoronaVac: still showing immune responses to original, Alpha, Beta &amp; Gamma in 53 vaxed people's blood studied up to 12 months. https://t.co/7HdwNzdCE2 (Participants from the PROFISCOV trial in Brazil)",,cnn-lstm,sinovac,sinovac coronavac still show immune response original alpha beta gamma vaxed people blood study month participant profiscov trial brazil
"RT @JChengWSJ: @natashakhanhk ""The study—which analyzed patients hospitalized during the city’s continuing Omicron wave and was funded by C…",,cnn-lstm,sinovac,studywhich analyze patient hospitalize city continue omicron wave fund
"@MonicaGandhi9 As a whole virion vaccine, why does Sinovac not produce improved protection against variants? Would this be similar with other inactived vaccines such as Covaxin?",,cnn-lstm,sinovac,whole virion vaccine sinovac produce improve protection variant would similar inactived vaccine covaxin
"RT @cnnphilippines: Gloriani reiterates that the same formulation of Sinovac for adults will also be used for pediatric vaccination.

READ:…",,cnn-lstm,sinovac,gloriani reiterates formulation sinovac adult also use pediatric vaccination read
Sophia Chan inspects COVID-19 Mobile Vaccination Station in Ta Kwu Ling where 400 people receive Sinovac vaccine - Hong Kong - DotDotNews https://t.co/5o7EBMrpFq https://t.co/HmharyPr96,,cnn-lstm,sinovac,sophia chan inspects covid mobile vaccination station kwu ling people receive sinovac vaccine hong kong dotdotnews
There has been a steady stream of tweets about how Sinovac was useless even though all available evidence said otherwise. Many gleeful &amp; disturbing predictions about how China would have massive deaths when Omicron hit. Those people are very quiet now they are proved wrong. 🧐 https://t.co/dh2edLmV70,,cnn-lstm,sinovac,steady stream tweet sinovac useless even though available evidence say otherwise many gleeful disturb prediction china would massive death omicron hit people quiet prove wrong
@jgriffiths @hkdemonow @hkumed said Sinovac is on par with BNT. Just forget it and use Sinovac. Sinovac FTW!!!,,cnn-lstm,sinovac,say sinovac par bnt forget use sinovac sinovac ftw
@simeydotme @CindyWan19 @RazvenHK Is it possible that these high ranking members of Hong Kong got a different vaccine than sinovac which is practically useless?,,cnn-lstm,sinovac,possible high rank member hong kong get different vaccine sinovac practically useless
"@gasman_al Hong Kong elderly was not smart enough to to used the time bought from mitigation to get vaccinated- falling into omicron is ‘mild’ trap &amp; higher risk ppl unvaccinated- severe mortality, cf Korea, vacc passport forced most to get vaccinated- less mortality, sinovac less effective https://t.co/lPuLutbC5Z https://t.co/eXTR2qmy5G",,cnn-lstm,sinovac,hong kong elderly stupid enough use time bought mitigation get vaccinate fall omicron mild trap high risk ppl unvaccinated severe mortality korea vacc passport force get vaccinate less mortality sinovac less effective
"@JLegalt @realGonzaloLira With sinovac and masking,phils.seems to have covid under control",,cnn-lstm,sinovac,sinovac mask philsseems covid control
"@JayLoh78 @Birdyword Mike I assumed the protections against severe disease, mortality in HK data are measured among the infected rather than vaccinated. (Need to find the exact definitions.) Sinovac's higher breakthrough infection rate in HK data was attributed to the higher death rate in Sing. data.",,cnn-lstm,sinovac,mike assume protection severe disease mortality data measure among infect rather vaccinate need find exact definition sinovac high breakthrough infection rate data attribute high death rate sing data
"@MartyBent @DowdEdward Phils.seemed have got covid by deactivated virus Sinovac, masking",,cnn-lstm,sinovac,philsseemed get covid deactivate virus sinovac mask
"Hong Kong data shows that three doses of the SINOVAC vaccine had a clear benefit over two in preventing severe illness or death in people over the age of 60, underscoring the importance of boosters for those who have received that Covid-19 shot.
https://t.co/WUxdvx35e7
From WSJ https://t.co/Fsd7MSRRSS",,cnn-lstm,sinovac,hong kong data show dos sinovac vaccine clear benefit prevent severe illness death people age underscore importance booster receive covid shot wsj
Most recent data from Hong Kong show that 3-dose Sinovac vaccine has the same VE values as 3-dose BNT vaccine for protection against severe covid and death ... https://t.co/R95H8I3tKt,,cnn-lstm,sinovac,recent data hong kong show dose sinovac vaccine value dose bnt vaccine protection severe covid death
"@zawiramin I think it’s started here as well. Maybe those on Sinovac want to check their MySJ? I checked mine, no have that option yet for AZ+PF",,cnn-lstm,sinovac,think start well maybe sinovac want check mysj checked mine refuse option yet azpf
"@natashakhanhk ""The study—which analyzed patients hospitalized during the city’s continuing Omicron wave and was funded by China’s Center for Disease Control and Prevention—showed three shots of the vaccine were 98% effective in preventing the worst outcomes.""
https://t.co/Q2ty7ICRRl",,cnn-lstm,sinovac,studywhich analyze patient hospitalize city continue omicron wave fund china center disease control preventionshowed shot vaccine effective prevent bad outcome
Good news about Sinovac out of Hong Kong. https://t.co/iU13vs7Ym6,,cnn-lstm,sinovac,good news sinovac hong kong
"Scientists at Hong Kong University found three doses of China’s Sinovac vaccine had a clear benefit over two in preventing severe illness or death in people over the age of 60, underscoring the importance of boosters.
@natashakhanhk
https://t.co/XpfkCVfdcX",,cnn-lstm,sinovac,scientist hong kong university found dos china sinovac vaccine clear benefit prevent severe illness death people age underscore importance booster
"Authorities have defended the effectiveness of the Sinovac vaccine following a report showing that majority of fifth-wave deaths among vaccinated Covid-19 patients had received the China-made jab
 https://t.co/mcnBLJb8o3",,cnn-lstm,sinovac,authority defend effectiveness sinovac vaccine follow report show majority fifthwave death among vaccinate covid patient receive chinamade jab
"Im just wondering.. after 1 April, Malaysia is allowing unvaccinated tourists (5 days quarantine), so does this mean the vaccine mandate is being dropped? So why you gotta force Sinovac recipients to take booster?",,cnn-lstm,sinovac,wonder april malaysia allow unvaccinated tourist day quarantine mean vaccine mandate drop get force sinovac recipient take booster
"China contemplating stopping COVID zero strategy;  Hong Kong not boosted/vax'd in older; S Korea declared endemic management but all depends on vaccinating &amp; boosting older people first &amp; foremost (with Sinovac, Sinopharm, 3 doses paramount as slightly less effective per WHO) https://t.co/9MXPTsmE8n",,cnn-lstm,sinovac,china contemplate stop covid strategy hong kong boostedvax old korea declare endemic management depends vaccinate boost old people first foremost sinovac sinopharm dos paramount slightly less effective per
@GailAnnStewart @CiaraRenarde @kylenabecker Sure it wasn't #SinoVac?,,cnn-lstm,sinovac,sure
"It now seems that Sinovac isn’t particularly ineffective after all, but that those who chose that vaccine have mostly not had all three jabs. I should probably not jump to conclusions just because I want something to be true 🤨",,cnn-lstm,sinovac,seem sinovac particularly ineffective chose vaccine mostly refuse jab probably jump conclusion want something true
"RT @MYFreedomMove: 2 million Sinovac recipients who refuse the booster will lose their ""fully vaccinated"" status but still be able to dine-…",,cnn-lstm,sinovac,sinovac recipient refuse booster lose fully vaccinate status still able dine
RT @TIME: Scott A. Rivkees: Setting the record straight about COVID-19 vaccines for children https://t.co/Itpn16mjfg,,cnn-lstm,sinovac,scott rivkees set record straight covid vaccine child
"@DrEricDing @JuliaDavisNews So they know their vaccine doesn't work.

https://t.co/upEwRQONk7",,cnn-lstm,sinovac,know vaccine idle
"RT @RealAndyLeeShow: This is interesting. Jerry Zheng, the founder and president of Artron Bioresearch, collaborates with Sinovac Biotech o…",,cnn-lstm,sinovac,interest jerry zheng founder president artron bioresearch collaborates sinovac biotech
"RT @5VeggieBalls: @hkfp On the 2nd last paragraph, she’d already proved the fatality rate for SinoVac takers is higher than Comirnaty taker…",,cnn-lstm,sinovac,last paragraph already prove fatality rate sinovac taker high comirnaty taker
RT @ayshardzn: ICYMI. 18 &amp; above Sinovac recipients &amp; senior citizens who have not been boosted will not be considered as fully vaxxed from…,,cnn-lstm,sinovac,icymi sinovac recipient senior citizen differ boost differ consider fully vaxxed
I hate to be a party pooper but… At the onset I was bashed as anti vaxxed or advocating vaxx hesitancy because of my firm stand against China vaccines. https://t.co/Vwg4QkmazA,,cnn-lstm,sinovac,hate party pooper onset bash anti vaxxed advocate vaxx hesitancy firm stand china vaccine
"""The Hong Kong wave is killing people at a rate exceeding that of almost any country ... a result, in large part, of low vaccination rates among older residents. Almost 90 percent of people who died during the latest wave were not fully immunized."" https://t.co/vvAB8wO7UP https://t.co/Ix65D6OWLq",,cnn-lstm,sinovac,hong kong wave kill people rate exceed almost country result large part low vaccination rate among old resident almost percent people die late wave meagerly immunize
"@TripperheadToo I Can Accept Cash!  The new HK ICAC is like the Sinovac vaccine, it’s crap!",,cnn-lstm,sinovac,accept cash new icac like sinovac vaccine crap
"@Tetrahydropyran @EMA_News I agree , but you may know that millions of people were vaccinated with Sinovac/Coronavac around the world. It was responsible for reducing deaths and hospitalizations in Brazil and many other countries, so there  is field evidence of its effectiveness",,cnn-lstm,sinovac,agree may know million people vaccinate sinovaccoronavac around world responsible reduce death hospitalization brazil many country field evidence effectiveness
@DFK_KLEE @KarryQuar @jamella_hoshino Sinopharm and Sinovac can help to bring down severe cases or deaths but not infection.,,cnn-lstm,sinovac,sinopharm sinovac help bring severe case death infection
"ICYMI

Experts assumed China needed an mRNA COVID vaccine to reopen safely. New data suggest that may not be the case.
https://t.co/1OPlq4TOIQ",,cnn-lstm,sinovac,icymi expert assume china need mrna covid vaccine reopen safely new data suggest may differ case
"RT @newswav: Sinovac recipients, do take note!

Check out the full story:
https://t.co/S198EVTnev - SoyaCincau

#Sinovac #SOP #dinein",,cnn-lstm,sinovac,sinovac recipient take note check full story soyacincau
"@DowdEdward Pretty much all of ukrainian refugees are technically not vexxed. 35% got jabbed w Sinovac,which is not recognized by german authorities. The majority has a critical view of the vexxes. Yet health ministry insists that all must get the vexx asap. More comedy to come",,cnn-lstm,sinovac,pretty much ukrainian refugee technically vexxed get jabbed sinovac recognize german authority majority critical view vexxes yet health ministry insists must get vexx asap comedy come
"@hkfp On the 2nd last paragraph, she’d already proved the fatality rate for SinoVac takers is higher than Comirnaty takers…  She can have different reasonings of the cause, but the numbers don’t tell lie unlike #GovHK .",,cnn-lstm,sinovac,last paragraph already prove fatality rate sinovac taker high comirnaty taker different reasoning number tell lie unlike
@twaneezy_ Get that Sinovac come autumn,,cnn-lstm,sinovac,get sinovac come autumn
@JayinShanghai Sinovac failure the biowapean backfired,,cnn-lstm,sinovac,sinovac failure biowapean backfire
RT @YanzhongHuang: Sinovac made a profit of $14.4 billion for 2021 from Covid vaccine sales.  Each dose of the vaccine produces an average…,,cnn-lstm,sinovac,sinovac make profit covid vaccine sale dose vaccine produce average
"@DrJamesOlsson Not a fan of going this route.  It was a very scary disease.  Was a fan of masks, the antiviral starts with letter ""I"" but I wanted antibodies.  Luckily I was able to get a traditional vaccine, Sinovac.  Traditional vaccines were kept out of the U.S.  But vaccines not needed now.",,cnn-lstm,sinovac,fan route scary disease fan mask antiviral start letter want antibody luckily able get traditional vaccine sinovac traditional vaccine kept vaccine obviate
@DrJamesOlsson Traditional vaccines should have been made available.  #Sinovac #Sinopharm,,cnn-lstm,sinovac,traditional vaccine make available
RT @DVB_English: The military’s Ministry of Health and Sport (MoHS) has announced the arrival of more than 2.2 million doses of the Sinovac…,,cnn-lstm,sinovac,military ministry health sport mohs announce arrival dos sinovac
"@leecronin The key difference is vaccine-induced immunity, which means that for most UK people, (asking they don't get long Covid) what you say is true. In Hong Kong, where vaccination of the elderly is &lt;50%, and mostly unboosted Sinovac, the Omicron death rate has been truly shocking.",,cnn-lstm,sinovac,key difference vaccineinduced immunity mean people ask leave long covid say true hong kong vaccination elderly mostly unboosted sinovac omicron death rate truly shock
"@YanzhongHuang @John_Kenney Right. Pretty sure John’s question was whether people in China need to pay for vaccination, not how Sinovac made money via vaccine.",,cnn-lstm,sinovac,right pretty sure john question whether people china need pay vaccination sinovac make money via vaccine
@xinwenfan Sinovac doesn’t do the trick,,cnn-lstm,sinovac,sinovac unmake trick
"RT @Athena2812: @Lyth_Hishmeh In Aug 2021 almost died twice of Delta. Was vaccinated with SINOVAC 2 doses. Wearing a mask got covid, in Kar…",,cnn-lstm,sinovac,aug almost die twice delta vaccinate sinovac dos wear mask get covid kar
"The good old rule of “the longer the rebuttal, the less ground they actually have” seems to hold true.
What Chan is painful trying to say is a classic case of “correlation not causation” - Sinovac had higher death rate because the people taking it had more additional risk factors https://t.co/CRKVKsbiUB",,cnn-lstm,sinovac,good old rule longer rebuttal less ground actually seem hold true chan painful try say classic case correlation causation sinovac high death rate people take additional risk factor
"RT @rki_de: 1/5
#COVID19 #vaccination recommendations updated
After 2-fold or 3-fold vaccination with non-EU-approved inactivated whole vir…",,cnn-lstm,sinovac,recommendation update fold fold vaccination noneuapproved inactivate whole vir
Sinovac made a profit of $14.4 billion for 2021 from Covid vaccine sales.  Each dose of the vaccine produces an average profit of $5.28 (It is sold for $32 per dose in China). https://t.co/cJ8Y2yHsXD,,cnn-lstm,sinovac,sinovac make profit covid vaccine sale dose vaccine produce average profit sell per dose china
Took seconds for KJ to drop the usefulness of the vac pass with his abrupt decisions on retaining the privileges of those sinovac recepients but at the same time removing their fully vaccinated status. #StopUsingMysejahtera https://t.co/2xAeB6rJy0,,cnn-lstm,sinovac,take second drop usefulness vac pas abrupt decision retain privilege sinovac recepients time remove fully vaccinate status
RT @KayThi01464791: 2.242 million doses of Sinovac (CoronaVac) vaccines donated by COVAX Facility under the arrangement of #UNICEF arrived…,,cnn-lstm,sinovac,dos sinovac coronavac vaccine donate covax facility arrangement arrive
RT @PDChina: More than 2.2 million doses of Sinovac #COVID19 vaccines donated by China through the COVAX Facility arrived in #Myanmar's Yan…,,cnn-lstm,sinovac,dos sinovac vaccine donate china covax facility arrive yan
"With such screaming headlines on return of Covid in China, one thing is clear. 

Unka Sinovac vaccine unke baaki saste Chinese maal ke jaise tikau nahin hai. 

China should perhaps seek Indian assistance through sales of India’s indigenously developed Covaxin for fighting Covid. https://t.co/iJThfTHXZL",,cnn-lstm,sinovac,scream headline return covid china thing clear unka sinovac vaccine unke baaki saste chinese maal jaise tikau nahin hai china perhaps seek indian assistance sale india indigenously developed covaxin fight covid
"@eugyppius1 You’re missing a lot of context here. With ineffective Sinovac and low booster uptake, China “getting it now” will mean vast numbers of hospitalizations and deaths. Getting it later might offer opportunities to be better prepared.",,cnn-lstm,sinovac,miss lot context ineffective sinovac low booster uptake china get mean vast number hospitalization death get later might offer opportunity well prepared
"RT @bruce_arthur: Between a weak Sinovac vaccine and the infectiousness of Omicron, I can't see how China avoids rolling outbreaks as part…",,cnn-lstm,sinovac,weak sinovac vaccine infectiousness omicron see china avoids roll outbreak part
"Between a weak Sinovac vaccine and the infectiousness of Omicron, I can't see how China avoids rolling outbreaks as part of a bigger wave, filled with rotating whack-a-mole lockdowns. This could be incredibly significant for China, and globally. https://t.co/uKgxllFPqd",,cnn-lstm,sinovac,weak sinovac vaccine infectiousness omicron see china avoids roll outbreak part big wave fill rotate whackamole lockdown could incredibly significant china globally
More than 2.2 million doses of Sinovac #COVID19 vaccines donated by China through the COVAX Facility have arrived in Myanmar https://t.co/cMK4DMIyh1 https://t.co/tDJmFirt7O,,cnn-lstm,sinovac,dos sinovac vaccine donate china covax facility arrive myanmar
@EMA_News @EU_Health @EU_Commission When do you think Sinovac is going to be approved by EMA? It is been almost one year since you begin evaluation.,,cnn-lstm,sinovac,think sinovac approve ema almost year since begin evaluation
"The military’s Ministry of Health and Sport (MoHS) has announced the arrival of more than 2.2 million doses of the Sinovac COVID-19 vaccine, imported with the help of UNICEF and donated by The Global Alliance for Vaccine and Immunization (GAVI COVAX Facility). /1 https://t.co/l7bMj8M2WP",,cnn-lstm,sinovac,military ministry health sport mohs announce arrival dos sinovac covid vaccine import help unicef donate global alliance vaccine immunization gavi covax facility
@Austria_UK Do you know when Sinovac is going to be accepted? And proof of vaccination to hotels and other sites for all vaccines?,,cnn-lstm,sinovac,know sinovac accepted proof vaccination hotel site vaccine
RT @DrEricDing: @NicoleChilders BA2 like BA1 old omicron both penetrant but somewhat equal. But China uses notoriously weaker SinoVac and s…,,cnn-lstm,sinovac,like old omicron penetrant somewhat equal china notoriously weaker sinovac
@KBeragama @malaysia_covid Lots of Sinovac though,,cnn-lstm,sinovac,lot sinovac though
"@lweisenthal @Antonio_Caramia The mRNA vs Sinovac, hospital system, elderly vaccination rate, boosting, and prior infection situation isn’t the same in Canada vs China. But what’s a fair number of person-weeks of lockdown to save a life (plus hospital costs, disability, etc.)?",,cnn-lstm,sinovac,mrna sinovac hospital system elderly vaccination rate boost prior infection situation canada china fair number personweeks lockdown save life plus hospital cost disability etc
"1/5
#COVID19 #vaccination recommendations updated
After 2-fold or 3-fold vaccination with non-EU-approved inactivated whole virus vaccine (#Sinovac, #Sinopharm, #Covaxin) or the vector-based vaccine #Sputnik V, a booster vaccination with an mRNA vaccine should be given.",,cnn-lstm,sinovac,recommendation update fold fold vaccination noneuapproved inactivate whole virus vaccine vectorbased vaccine booster vaccination mrna vaccine give
the sinovac quarantine discrimination situation is so fucking funny,,cnn-lstm,sinovac,sinovac quarantine discrimination situation fuck funny
@Same_Sarikei @Khairykj Getting Sinovac makes me speaking Mandarin better 🥰,,cnn-lstm,sinovac,get sinovac make speak mandarin well
"Govt spares rod on unboosted

Minister said 2m with two doses of Sinovac chose not to get boosted.

Interestingly no reason was given.

@codebluenews https://t.co/rh7EmD2R4g",,cnn-lstm,sinovac,govt spare rod unboosted minister say dos sinovac chose get boost interestingly reason give
"@jospoke1 @milliron444 @DrEricDing That’s the thing. Full function may not happen soon. Locking people away is not the right idea. It only mutates the disease more. You have to address it and ride it out. 

Sinovac did not work. Their vaccine numbers are to low. This is going to cause mutations",,cnn-lstm,sinovac,thing full function may dematerialize soon lock people away right idea mutates disease address ride sinovac idle vaccine number low mutation
"RT @NewsBFM: 1. Adults who have not taken booster shot can still dine in and enter malls, offices and places of worship, despite losing the…",,cnn-lstm,sinovac,adult refuse booster shot still dine enter mall office place worship despite lose
"A new delivery of #Sinovac has reached #Myanmar via #COVAX. According to our #ChinaCOVID19 tracker, Myanmar has received around 44 million doses of vaccines through bilateral contributions and a further 4 million via COVAX so far. Read more: https://t.co/kb3KtETDgA",,cnn-lstm,sinovac,new delivery reach via accord tracker myanmar receive around dos vaccine bilateral contribution via covax far read
